{
  "$schema": "https://json-schema.org/draft/2020-12/schema",
  "$id": "devkit/claude-marketplace",
  "x-provenance": "best-effort",
  "type": "object",
  "additionalProperties": false,
  "required": ["_generated", "name", "description", "owner", "plugins"],
  "$defs": {
    "author": {
      "type": "object",
      "additionalProperties": false,
      "required": ["name", "email"],
      "properties": {
        "name": { "type": "string", "minLength": 1 },
        "email": { "type": "string", "format": "email" }
      }
    }
  },
  "properties": {
    "_generated": { "type": "string" },
    "name": { "type": "string", "minLength": 1 },
    "description": { "type": "string", "minLength": 1 },
    "owner": { "$ref": "#/$defs/author" },
    "plugins": {
      "type": "array",
      "minItems": 1,
      "items": {
        "type": "object",
        "additionalProperties": false,
        "required": ["name", "description", "version", "source", "author"],
        "properties": {
          "name": { "type": "string", "minLength": 1 },
          "description": { "type": "string", "minLength": 1 },
          "version": {
            "type": "string",
            "pattern": "^\\d+\\.\\d+\\.\\d+([-+].+)?$"
          },
          "source": { "const": "./" },
          "author": { "$ref": "#/$defs/author" }
        }
      }
    }
  }
}
