{
  "_generated": "GENERATED by scripts/generate.ts — edit marketplace.config.ts instead",
  "name": "devkit-marketplace",
  "description": "Developer-workflow skills for AI coding agents",
  "owner": {
    "name": "Rahul Muttineni",
    "email": "rahulmutt@gmail.com"
  },
  "plugins": [
    {
      "name": "devkit",
      "description": "Engineering-discipline skills for AI coding agents: pinned dev environments, test strategy, clean code, security, and navigable repos",
      "version": "0.2.0",
      "source": "./",
      "author": {
        "name": "Rahul Muttineni",
        "email": "rahulmutt@gmail.com"
      }
    }
  ]
}
